{
  "vectorSchema": "blind-ledger-bl-pq512-foundation-vector-v1",
  "referenceStatus": "SYNTHETIC_T01_STRUCTURE_AND_P01_P02_TREE_KAT_NOT_T02",
  "profileId": "BL-PQ512-v1",
  "referenceSchemaId": "BL-PQ512-TREE-REFERENCE-v0",
  "domainSuite": "BL-PQ512-REFERENCE/v0",
  "caseId": "synthetic-foundation-approved-0001",
  "privateSemantics": {
    "syntheticOnly": true,
    "snapshotId": "SYNTHETIC-FOUNDATION-0001",
    "snapshotVersion": 0,
    "decision": "approved",
    "failureCode": 0,
    "allowedCents": "00000000000030d4",
    "payableCents": "00000000000030d4",
    "canonicalRecordsHex": [
      "424c2f50513531322f43414e4f4e4943414c2f5245464552454e43452f76300020424c2f50513531322f5241572d5245434f52442f5245464552454e43452f7630000b424c2d50513531322d7631001a424c2d50513531322d545245452d5245464552454e43452d7630001973796e7468657469635f676f7665726e6d656e745f617574680007000e6d6574612e7265636f72645f6964610000001353594e5448455449432d415554482d30303031000f6d6574612e616461707465725f6964610000002853594e5448455449432d474f5645524e4d454e542d4d454d4f52592d5245464552454e43452d563000106d6574612e736e617073686f745f6964610000001953594e5448455449432d464f554e444154494f4e2d3030303100126d6574612e736f757263655f73797374656d610000000e53594e5448455449432d4155544800156d6574612e736e617073686f745f76657273696f6e38000000080000000000000000001d7061796c6f61642e617574686f72697a6174696f6e5f70726573656e743f0000000101001f7061796c6f61642e617574686f72697a6174696f6e5f7265666572656e6365610000001353594e5448455449432d415554482d30303031",
      "424c2f50513531322f43414e4f4e4943414c2f5245464552454e43452f76300020424c2f50513531322f5241572d5245434f52442f5245464552454e43452f7630000b424c2d50513531322d7631001a424c2d50513531322d545245452d5245464552454e43452d7630001a73796e7468657469635f676f7665726e6d656e745f636c61696d0007000e6d6574612e7265636f72645f6964610000001453594e5448455449432d434c41494d2d30303031000f6d6574612e616461707465725f6964610000002853594e5448455449432d474f5645524e4d454e542d4d454d4f52592d5245464552454e43452d563000106d6574612e736e617073686f745f6964610000001953594e5448455449432d464f554e444154494f4e2d3030303100107061796c6f61642e636c61696d5f6964610000001453594e5448455449432d434c41494d2d3030303100126d6574612e736f757263655f73797374656d610000001053594e5448455449432d434c41494d5300137061796c6f61642e746f74616c5f63656e7473380000000800000000000030d400156d6574612e736e617073686f745f76657273696f6e38000000080000000000000000",
      "424c2f50513531322f43414e4f4e4943414c2f5245464552454e43452f76300020424c2f50513531322f5241572d5245434f52442f5245464552454e43452f7630000b424c2d50513531322d7631001a424c2d50513531322d545245452d5245464552454e43452d7630001b73796e7468657469635f676f7665726e6d656e745f6f7261636c650007000e6d6574612e7265636f72645f6964610000001553594e5448455449432d4f5241434c452d30303031000f6d6574612e616461707465725f6964610000002853594e5448455449432d474f5645524e4d454e542d4d454d4f52592d5245464552454e43452d563000106d6574612e736e617073686f745f6964610000001953594e5448455449432d464f554e444154494f4e2d3030303100126d6574612e736f757263655f73797374656d610000001053594e5448455449432d4f5241434c4500156d6574612e736e617073686f745f76657273696f6e3800000008000000000000000000197061796c6f61642e70726f76696465725f656e726f6c6c65643f0000000101001a7061796c6f61642e656c69676962696c6974795f6163746976653f0000000101",
      "424c2f50513531322f43414e4f4e4943414c2f5245464552454e43452f76300020424c2f50513531322f5241572d5245434f52442f5245464552454e43452f7630000b424c2d50513531322d7631001a424c2d50513531322d545245452d5245464552454e43452d7630001b73796e7468657469635f676f7665726e6d656e745f706f6c6963790007000e6d6574612e7265636f72645f6964610000001553594e5448455449432d504f4c4943592d30303031000f6d6574612e616461707465725f6964610000002853594e5448455449432d474f5645524e4d454e542d4d454d4f52592d5245464552454e43452d563000106d6574612e736e617073686f745f6964610000001953594e5448455449432d464f554e444154494f4e2d3030303100117061796c6f61642e6665655f63656e7473380000000800000000000030d400126d6574612e736f757263655f73797374656d610000001053594e5448455449432d504f4c49435900156d6574612e736e617073686f745f76657273696f6e3800000008000000000000000000167061796c6f61642e706f6c6963795f76657273696f6e610000001d53594e5448455449432d504f4c4943592d5245464552454e43452d5630"
    ],
    "orderedOperations": [
      "load_government_snapshot",
      "derive_legacy_reference_tree",
      "derive_wide_reference_tree",
      "emit_privacy_v2_compatibility",
      "bind_logical_wide_sidecar"
    ],
    "recordManifestSha3_512": "2472feba1c94f9e6aea44594102f7481f27ef9fe0e52296fb869fb7273c000bc78c5f1183299ee3f8df7beecf8e0f25ddb7a4775a5097c0cb8b2aa2ea39cf268",
    "legacyTree": {
      "treeKind": "government_snapshot",
      "treeHeight": 2,
      "leafFeltHex": [
        "0091f52dee6224f289fb563bb3a44b616b70698441c63445acbed7139c05da68",
        "025332d9bd75d4af391a479895f5d7da23d893a220dc7f86122703103140c99d",
        "06df730e25e38bfe17de711d889780cb926370febc04883d4c7efbac5a612343",
        "027abb7c4e7a9d1ba5a95408441c64b8ad63f1a285db2c14e3d557dc7cbc95e4"
      ],
      "rootFeltHex": "05bd6babe2adce54053f3dc4c3876125512f159834c1cd51a46d4898dc07a29f"
    },
    "wideTree": {
      "treeKind": "government_snapshot",
      "treeHeight": 2,
      "leafSha3_512": [
        "76a287626e805d25bd0bca8ba8aed56260758fc6582eec5d0cc554e698f790dfc5723b3aacc19593516c4d546e53bce5b7a10393d9fd1f036dc3da2d2ff32ade",
        "77f581b7e02598b7af3da1ff4313cf36afdb338089fdb9521fdfaf0e13767cf6a4a59f911d5a8d87454ebfdaa2b6141af29245c8838b2d3996b371c0d16e2ab6",
        "c6a58e670999b456914afe553152f6cda47b3a506aaab5531db6d3f241bad68a0c4b3795c356e1db4cc5e8bb3618b2684f780a5fb1f8a8158cbb2e65efaf9ad9",
        "264837e4abe015e4ce7b3f92e4d9c7224e1858e6a1bb2b0b28708d2abc79bd6965d554f3958e07b32c79c9b0ad3e7c137d7a5cec837209ce0cdc82c7aef7a411"
      ],
      "rootSha3_512": "86cbacdecad1a903e3d3f09513da8b556221a1365b875d963d7ff8cd275b73a559a635919c7c8f50a2a1dcaa3993b60a43fe98bdbcedfce534e62d12d44b43a5"
    }
  },
  "compatibilityOutputs": [
    {
      "index": 0,
      "name": "protocolVersion",
      "feltHex": "0000000000000000000000000000000000000000000000000000000000000002"
    },
    {
      "index": 1,
      "name": "settlementDomain",
      "feltHex": "0000000000000000000000000000000000000000000000000000000000001b59"
    },
    {
      "index": 2,
      "name": "batchNonce",
      "feltHex": "0000000000000000000000000000000000000000000000000000000000002329"
    },
    {
      "index": 3,
      "name": "nullifierRootBefore",
      "feltHex": "0000000000000000000000000000000000000000000000000000000000000065"
    },
    {
      "index": 4,
      "name": "nullifierRootAfter",
      "feltHex": "00000000000000000000000000000000000000000000000000000000000000ca"
    },
    {
      "index": 5,
      "name": "claimSourceRoot",
      "feltHex": "000000000000000000000000000000000000000000000000000000000000012d"
    },
    {
      "index": 6,
      "name": "oracleFactsRoot",
      "feltHex": "000000000000000000000000000000000000000000000000000000000000012e"
    },
    {
      "index": 7,
      "name": "policyRoot",
      "feltHex": "000000000000000000000000000000000000000000000000000000000000012f"
    },
    {
      "index": 8,
      "name": "rulesetRoot",
      "feltHex": "0000000000000000000000000000000000000000000000000000000000000130"
    },
    {
      "index": 9,
      "name": "opaqueBatchCommitment",
      "feltHex": "0000000000000000000000000000000000000000000000000000000000000191"
    },
    {
      "index": 10,
      "name": "valueConservationCommitment",
      "feltHex": "0000000000000000000000000000000000000000000000000000000000000192"
    },
    {
      "index": 11,
      "name": "settlementCommitment",
      "feltHex": "0000000000000000000000000000000000000000000000000000000000000193"
    }
  ],
  "wideSidecar": {
    "profileId": "BL-PQ512-v1",
    "proofSuiteId": "TBD-S07-S08-S09-NOT-SELECTED",
    "schemaId": "TBD-S12-P06-NOT-FROZEN",
    "epoch": "0000000000000007",
    "sequenceBefore": "0000000000000000",
    "sequenceAfter": "0000000000000001",
    "strongNullifierRootBefore": "a40dcc3c6e969ed7fa22fb33ccf700f7735095fd4b5abd4aef1ab216fabbe354b580bea09b15ef50c6428a111f2cb4f31e9707bb3992d8470a95d091799aaa24",
    "strongNullifierRootAfter": "931797e1e8d72968b4a783ca37532d3f8785fed6aff34e42b830ab2d9f513010071b798d91721431e147ff68f5b365ed0f3d60da1a5980315730ec8b761e5957",
    "strongGovernanceCommitment": "aa0aa7ff8c799764937c3f0be8bf2d8bc093d30e872ad271baffac3f6f39f2f31c70241840bca5cc030e2daf2e36ee54cfb75e15fb38ec71224dfc77b0ff8551",
    "strongPaymentStateBinding": {
      "status": "UNRESOLVED-A11-P05",
      "bindingKind": "TBD",
      "bindingValue": null
    },
    "verifierArtifactIdentity": "6747408e4ce161b5cf2d7e2d6b7695d38be3723f768e87a65a8f4d8c04210ccee54215755d12b0dfd680bf7c2a4286ea9f3af0483d76a82a397d2a2afbec3780",
    "strongBatchCommitment": "a9fdc36a1feff78ee9caaf484c3449c54a3fb2f2010cab01109ae8635e9ec749ce273edfd47306b03de582bfcb57cbacd4666911050405771d0735607c55265e",
    "encodingStatus": "LOGICAL_PLACEHOLDERS_S04_P06_OPEN_NOT_AUTHENTICATED"
  }
}
